{
  "$ref": "#/definitions/posts",
  "definitions": {
    "posts": {
      "type": "object",
      "properties": {
        "slug": {
          "type": "string"
        },
        "title": {
          "type": "string"
        },
        "excerpt": {
          "type": "string"
        },
        "date": {
          "anyOf": [
            {
              "type": "string",
              "format": "date-time"
            },
            {
              "type": "string",
              "format": "date"
            },
            {
              "type": "integer",
              "format": "unix-time"
            }
          ]
        },
        "tags": {
          "type": "array",
          "items": {
            "type": "string"
          }
        },
        "sourceAuthor": {
          "type": "string"
        },
        "sourceYear": {
          "type": "string"
        },
        "$schema": {
          "type": "string"
        }
      },
      "required": [
        "slug",
        "title",
        "excerpt",
        "date",
        "tags"
      ],
      "additionalProperties": false
    }
  },
  "$schema": "http://json-schema.org/draft-07/schema#"
}