{
  "slug": "spencer-correct-or-stay-silent",
  "title": "To Correct, or Stay Silent",
  "excerpt": "Herbert Spencer's 1879 framework for when to call out a wrong statement — and when to let it pass. A decision tree, a flowchart, and a plain-language read for the age of the reply guy.",
  "date": "2026-05-31",
  "tags": ["ethics", "social-discourse", "victorian-philosophy", "decision-making"],
  "sourceAuthor": "Herbert Spencer",
  "sourceYear": "1879"
}
